LinkID,RecID,q0d_HouseID,q0b_state,q0c_ID,q0c_date,q1_NoFloors,q2_Awake,q2_other,q3_NoRooms,q4_wood,q4_arearug,q4_carpet,q4_cement,q4_other,q4_specify,q5_Carpeted,q6_dust,q6_additional,q6_detail,q7_Intersection,q8_Wood,q8_Brick,q8_VinylAl,q8_Concrete,q8_Stucco,q8_AsbAsph,q8_Other,q8_specify,q9_slab,q9_crawl,q9_basecrawl,q9_fullbase,q9_other,q9_specify,q9f_dontknow,q10_havebasement,q11_typebase,q11e_unvented,q11f_other,q11f_specify,q12_pool,q13_located,q14_hottub,q15_emissions,q15_specify,q16_DC200,q16_DCHalf,q16_GS200,q16_GSHalf,q16_FR200,q16_FRHalf,q16_Rest200,q16_RestHalf,q16_Bake200,q16_BakeHalf,q16_Other200,q16_specify200,q16_OtherHalf,q16_specifyHalf,q17a_major,q17b_truck,q17c_airport,q17d_flight,q17e_shipping,q17f_bus,q17g_train,q17h_unpaved,q17i_other,q17i_specify,q18_pets,q18_list,q19_volume_m3,q19_volume_outside,q19_volume_inside,q19_vol_ft3,q20_store_cleaning_compds,qfp1_outside,qfp1_units,qfp2_inside,qfp2_units,qfp3_units,qfp3_basement,qfp3_first,qfp3_second,qfp3_third,qfp3_fourth,qfp3_attic
CA042110,31,CA052,CA,NY,"2000-05-08 00:00:00",1,B,,7,0,1,1,0,0,,4,C,0,,"SPROUL AVE. AND MILITARY AVE.",1,0,0,0,1,0,0,,1,0,0,0,0,,0,0,,0,0,,0,,0,0,,0,1,0,1,0,0,0,1,0,1,0,,0,,0,0,2,274.32,0,0,0,0,0,NULL,0,,0,0,0,3070,"cleaners under kitchen and bathroom sinks, sealed paintcans in backyard",0,,0,,,0,0,0,0,0,0
CA043110,32,CA053,CA,DS,"2000-05-11 00:00:00",2,B,,4,0,0,1,0,1,TILE,3,C,0,,"S. SEPULVEDA AND RICHLAND",0,0,0,1,0,0,0,,0,0,0,0,1,GARAGE,0,0,,0,0,,0,,0,0,,0,1,0,1,0,0,0,1,0,1,0,,1,LUMBERYARD,91.44,182.88,2,0,0,0,0,0,0,NULL,0,,0,0,0,3760,"cleaners in 2nd floor bathroom bt sink and toilet",0,,0,,,0,0,0,0,0,0
CA044110,4,CA054,CA,NY,"2000-05-15 00:00:00",1,B,,6,0,0,1,0,0,,5,B,0,,"ELFORD & YODER",0,0,0,0,1,0,0,,1,0,0,0,0,,0,0,,0,0,,1,B,0,1,"COMPUTER PARTS, CEME",0,0,0,1,0,0,0,0,0,0,0,,0,,45.72,0,0,0,0,0,0,0,0,NULL,1,"2 DOGS OUTSIDE",0,0,0,6405,"under kitchen sink and master bedroom sink; paints and other in garage",0,,0,,,0,0,0,0,0,0
CA045110,33,CA055,CA,DS,"2000-05-18 00:00:00",2,B,,5,0,1,1,0,1,"TILE IN BATHROOM AND",4,B,0,,"AYRES AND PROSSER",0,0,0,1,0,0,0,,0,1,0,0,0,,0,0,,0,0,,0,,0,0,,0,0,0,1,0,0,0,1,0,0,0,,0,,0,1,3,1,0,0,0,0,0,NULL,0,,0,0,0,5959,"cleaners under bathroom and kitchen sinks",0,,0,,,0,0,0,0,0,0
CA046110,3,CA056,CA,"DS, NY","2000-05-19 00:00:00",1,B,,6,0,0,1,0,0,,5,B,0,,,1,1,0,0,1,0,0,,1,0,0,0,0,,0,0,,0,0,,0,,0,1,,0,0,0,0,0,0,0,0,0,0,0,,0,,0,0,0,1,0,0,0,0,0,NULL,1,"1 GOLDFISH",0,0,0,4311,"under kitchen sink and master bath sink",0,,0,,,0,0,0,0,0,0
CA047110,87,CA057,CA,NY,"2000-05-25 00:00:00",1,B,,5,0,0,1,0,1,VINYL,2,B,0,,"ELFORD AND YODDER ST.",0,0,0,0,1,0,0,,1,0,0,0,0,,0,0,,0,0,,0,,0,0,,0,0,0,0,0,0,0,0,0,0,0,,0,,45.72,182.88,0,0,0,0,0,0,0,NULL,0,,0,0,0,4473,"cleaners in kitchen cabinet and pesticides outside",0,,0,,,0,0,0,0,0,0
CA048110,88,CA058,CA,DS,"2000-06-09 00:00:00",2,B,,7,1,0,1,0,1,"KITCHEN TILE",3,C,0,,"DANVILLE AND SANDOVAL",0,1,0,0,1,1,0,,0,1,0,0,0,,0,0,,0,0,,0,,0,0,,0,0,0,0,0,0,0,0,0,0,1,"2-3 DIFFERENT INDUST",0,,1,0,0,0,0,0,0,0,0,NULL,0,,0,0,0,8536,"cleaners under kitchen and bathroom sinks, paints on oatio, paints and insectici",0,,0,,,0,0,0,0,0,0
CA049110,89,CA059,CA,DS,"2000-06-09 00:00:00",1,B,,6,0,0,1,0,1,"TILE IN KITCHEN AND",5,C,0,,"CROTON AND NOYES",0,0,0,1,0,0,0,,1,0,0,0,0,,0,0,,0,0,,0,,0,1,"2-3 INDUSTRIES OFF S",0,0,0,0,0,0,0,0,0,0,0,,0,,182.88,0,0,0,0,0,0,0,0,NULL,1,"2 DOGS",0,0,0,3976,"cleaners under kitchen sink, paints and insecticides in shed",0,,0,,,0,0,0,0,0,0
CA050110,90,CA060,CA,DS,"2000-06-12 00:00:00",1,B,,5,0,0,1,0,1,"KITCHEN TILE",4,C,0,,"BALMORAL AND CROTON AVE.",1,0,0,1,0,0,0,,1,0,0,0,0,,0,0,,0,0,,1,B,1,0,"2-3 INDUSTRIES OFF S",0,0,0,1,0,0,0,0,0,0,0,,0,,137.16,1,0,0,1,0,0,0,0,NULL,0,,0,0,0,4457,"cleaners under kitchen sink and in guest room, insecticides in guestroom",0,,0,,,0,0,0,0,0,0
CA051110,91,CA061,CA,NY,"2000-06-23 00:00:00",1,B,,6,0,0,1,0,1,"KITCHEN TILE",4,C,0,,"OAKLAWN AND BELMONT",1,0,0,0,1,0,0,,1,0,0,0,0,,0,0,,0,0,,0,,0,0,,0,0,0,1,0,0,0,1,0,0,1,"2-3 INDUSTRIES OFF S",0,,0,0,0,0,0,0,0,0,0,NULL,1,"1 DOG (OUTSIDE)",0,0,0,5152,"cleaners under kitchen sink",0,,0,,,0,0,0,0,0,0
CA052110,92,CA062,CA,NY,"2000-06-16 00:00:00",1,B,,6,0,0,1,0,0,,4,C,0,,"DURFEE AND BATA RD.",0,1,0,0,1,0,0,,0,1,0,0,0,,0,0,,0,0,,0,,0,0,,0,0,0,1,0,0,0,0,0,0,0,,0,,0,0,0,0,2,0,0,0,0,NULL,0,,0,0,0,8390,"cleaners under kitchen and bathroom sinks, paints and pesticides abouve laundry",0,,0,,,0,0,0,0,0,0
CA053110,93,CA063,CA,NY,"2000-07-05 00:00:00",1,B,,5,0,0,1,0,1,VINYL,3,B,0,,"FRIENSHIP AND DURFEE AVE.",1,1,0,1,0,0,0,,0,1,0,0,0,,0,0,,0,0,,0,,0,0,,0,0,0,0,0,0,0,0,0,0,0,,0,,0,0,0,0,0,0,0,0,0,NULL,0,,0,0,0,6874,,0,,0,,,0,0,0,0,0,0
CA054110,94,CA064,CA,"NY, JJ","2000-07-10 00:00:00",1,B,,6,0,0,1,0,0,,4,B,0,,"BRIERFIELD AND SANDOVAL",0,1,0,0,1,0,0,,0,1,0,0,0,,0,0,,0,0,,0,,0,0,,0,0,0,0,0,0,0,0,0,0,0,,0,,0,0,0,0,0,0,0,0,0,NULL,1,"1 TURTLE",0,0,0,5092,,0,,0,,,0,0,0,0,0,0
CA055110,95,CA065,CA,"DS, NY","2000-06-26 00:00:00",1,B,,6,0,0,1,0,0,,4,A,0,,"CHAPELLE AND CATE RD.",1,0,0,1,1,0,0,,0,1,0,0,0,,0,0,,0,0,,1,B,0,0,,0,0,0,1,0,0,0,0,0,0,0,,0,,0,0,0,0,0,0,0,0,0,NULL,1,"I DOG, FISH",0,0,0,4910,"cleaners under kitchen sink, insecticides and paint in garage",0,,0,,,0,0,0,0,0,0
CA056110,96,CA066,CA,SS,"2000-07-31 00:00:00",1,B,,5,0,0,1,0,0,,4,B,0,,"DOMO AND ELFORD",1,0,0,0,1,0,0,,1,0,0,0,0,,0,0,,0,0,,0,,0,0,"2-3 INDUSTRIES OFF S",0,0,0,1,0,0,0,0,0,0,1,FREEWAY,0,,27.432,0,0,0,0,0,0,0,0,NULL,0,,0,0,0,4569,"cleaners under kitchen and bathroom sinks",0,,0,,,0,0,0,0,0,0
CA057110,34,CA067,CA,DS,"2000-07-17 00:00:00",1,B,,5,1,0,0,0,0,,0,B,0,,"ESTHER AND WESTWOOD",1,1,0,0,1,0,0,,0,1,0,0,0,,0,0,,0,0,,0,,0,0,,0,0,0,1,0,0,0,1,0,0,0,,0,,0,0,0,457.2,0,0,0,0,0,NULL,0,"1 CAT",0,0,0,5929,"cleaners on back porche and paint in garage",0,,0,,,0,0,0,0,0,0
CA058110,35,CA068,CA,SS,"2000-07-17 00:00:00",2,B,,6,0,0,1,0,0,"LINOLEUM IN KITCHEN",4,C,0,,"SELBY AND CLARKSON",0,1,0,0,0,0,0,,1,0,0,0,0,,0,0,,0,0,,0,,0,0,,0,0,0,1,0,0,0,1,0,1,1,FREEWAY,0,,68.58,0,0,0,0,0,0,0,0,NULL,0,"1 DOG",0,0,0,5135,"cleaners on dryer and paints in garage",0,,0,,,0,0,0,0,0,0
CA059110,36,CA069,CA,NY,"2000-07-24 00:00:00",2,B,,7,1,1,1,0,0,,2,C,0,,"GRAND VIEW AND NATIONAL",0,1,0,0,1,0,0,,0,1,0,0,0,,0,0,,0,0,,0,,1,0,,0,0,0,1,0,0,0,1,0,0,1,"BALLFIELDS ACROSS ST",0,,0,0,1,0,0,0,0,0,0,NULL,0,"1 DOG",0,0,0,8676,"paints and pesticides in garage, cleaners under kitchen sink, on shelves abouve",0,,0,,,0,0,0,0,0,0
CA060110,37,CA070,CA,"SS, NY","2000-07-21 00:00:00",1,B,,6,1,1,1,0,1,"LINOLEUM IN KITCHEN",2,A,0,,"LAWLER AND INGELWOOD",0,1,0,0,1,0,0,,0,1,0,0,0,,0,0,,0,0,,0,,0,0,,0,0,0,0,0,0,0,0,0,0,0,,0,,1,0,4,3,0,0,0,0,0,NULL,0,"2 BIRDS, 1 LIZARD",0,0,0,10469,"paints in shed, cleaners under kitchen sink and in utility closet",0,,0,,,0,0,0,0,0,0
CA061110,38,CA071,CA,DS,"2000-08-04 00:00:00",1,B,,5,0,1,1,0,1,"KITCHEN TILE",2,C,0,,"KELTON AND EXPOSIION",1,0,0,1,0,0,0,,0,1,0,0,0,,0,0,,0,0,,0,,0,1,"CEMENT PLANT (.25 M)",0,0,0,1,0,0,0,1,0,0,0,,1,"CEMENT PLANT",45.72,320.04,2,0,0,0,0,0,0,NULL,0,,0,0,0,7362,"paints and insecticides in garage, cleaners under kitchen sink and in hall close",0,,0,,,0,0,0,0,0,0
CA062110,39,CA072,CA,SS,"2000-08-23 00:00:00",1,B,,6,1,1,0,0,1,"KITCHEN LINOLEUM",3,A,0,,"OVERLAND AND ESTHER",0,0,0,0,1,0,0,,0,1,0,0,0,,0,0,,0,0,,0,,0,0,,0,1,0,1,0,0,0,1,0,1,0,,1,FREEWAY,0,0,0,0,0,0,0,0,0,NULL,0,"1 DOG",0,0,0,6353,"cleaners under bathroom and kitchen sinks",0,,0,,,0,0,0,0,0,0
CA063110,40,CA073,CA,CF,"2000-09-14 00:00:00",3,B,,7,0,1,0,0,0,,0,C,0,,"PICO AND AYRES",1,0,0,0,0,0,0,,1,1,0,0,0,,0,0,,0,0,,0,,0,0,,1,1,0,1,0,0,1,1,0,0,0,,1,"PARK AND GOLF COURSE",18.288,0,0,0,0,0,0,0,0,NULL,0,"2 DOGS",0,0,0,12612,"cleaners under kitchen sink, in laundrey room, and in garage",0,,0,,,0,0,0,0,0,0
CA065110,2,CA075,CA,"JJ, SS","2000-07-17 00:00:00",1,B,,5,1,0,1,0,1,LINOLEUM,4,A,1,"A-CONSTRUCTION DUST","MAGNOLIA & SHELTON",0,0,0,0,1,0,0,,0,1,0,0,0,,0,0,,0,0,,0,,0,1,"BURBANK TRANSMISSION",0,1,0,1,0,0,1,1,0,1,0,,1,"AUTO MACHINE SHOP 2",0,36.576,3,0,0,0,0,0,0,NULL,1,"1 DOG",0,0,0,8222,"under kitchen and bathroom sinks, in laundry room",0,,0,,,0,0,0,0,0,0
CA066110,1,CA076,CA,CORI,"2000-07-24 00:00:00",1,B,,4,0,0,1,0,1,LINOLEUM,3,B,0,,"CHANDLER & SHELTON, MAGNOLIA & SHELTON",0,0,0,0,1,0,0,,0,1,0,0,0,,0,0,,0,0,,0,,0,1,"FORMERLY A PLATING P",0,0,0,1,1,0,0,1,0,1,0,,1,"INDUSTRY ON CHANDLER",0,182.88,2,0,0,0,1,0,0,NULL,0,,0,0,0,5634,"cleaners under kitchen and bathroom sinks, bleach in service porch, paints and p",0,,0,,,0,0,0,0,0,0
CA067110,97,CA077,CA,NY,"2000-07-28 00:00:00",1,B,,6,0,0,1,0,0,,6,B,0,,"SCOTT AND SAN FERNANDO RD.",1,1,0,0,1,0,0,,0,1,0,0,0,,0,0,,0,0,,0,,0,0,,0,1,0,1,0,0,1,1,0,1,1,FREEWAY,0,,18.288,32.004,4,0,0,0,0,0,0,NULL,0,,0,0,0,6008,"cleaners in laundry closet",0,,0,,,0,0,0,0,0,0
CA068110,98,CA078,CA,DS,"2000-08-10 00:00:00",1,B,,5,0,0,1,0,1,"KITCHEN TILE",4,C,0,,"N. GRIFITH PARK RD. AND BURBANK BLVD.",1,0,0,0,1,0,0,,0,1,0,0,0,,0,0,,0,0,,0,,0,0,,0,0,0,1,0,0,0,1,0,0,0,,0,,228.6,0,2,1,0,0,0,0,0,NULL,0,,0,0,0,7585,"cleaners in ktchen cupborad",0,,0,,,0,0,0,0,0,0
CA069110,99,CA079,CA,JJ,"2000-08-30 00:00:00",1,B,,4,1,0,0,0,0,,0,B,0,,"BEACHWOOD AND CHANDLER BLVD.",1,0,0,1,1,0,0,,1,0,0,0,0,,0,0,,0,0,,0,,0,0,,0,0,0,0,0,0,0,1,0,1,0,,0,,0,0,0,0,0,0,0,0,1,NULL,0,,0,0,0,6441,"cleaners in washing machine area",0,,0,,,0,0,0,0,0,0
CA070110,100,CA080,CA,DS,"2000-09-08 00:00:00",2,C,,4,0,0,1,0,1,"KITCHEN TILE",3,C,0,,"SCOTT AND SAN FERNANDO RD.",0,0,0,0,1,0,0,,1,0,0,0,0,,0,0,,0,0,,1,B,1,0,,0,1,0,1,0,0,0,1,0,1,0,,0,,0,0,0,0,0,0,0,0,0,NULL,0,,0,0,0,7518,"cleaners under bathroom and kitchen sinks",0,,0,,,0,0,0,0,0,0
CA071110,101,CA081,CA,NY,"2000-09-18 00:00:00",1,B,,9,1,1,1,0,1,BRICK,1,A,0,,"BROADWAY AND AMHERST",1,0,0,0,1,0,0,,0,1,0,0,0,,0,0,,0,0,,0,,0,0,,0,1,1,1,0,0,1,1,0,1,0,,0,,45.72,0,3,1,0,0,0,0,0,NULL,1,"1 CAT, 1 DOG (OUTSID",0,0,0,4027,"cleaners under kitchen sink, above laundry.  Paints outside",0,,0,,,0,0,0,0,0,0
CA072110,102,CA082,CA,JJ,"2000-09-15 00:00:00",2,B,,4,0,0,1,0,1,"LINOLEUM IN KITCHEN",3,B,0,,"SCOTT AND SAN FERNANDO",0,0,0,0,1,0,0,,1,0,0,0,0,,0,0,,0,0,,1,B,1,1,"POWER PLANT (1.5 M)",0,0,0,1,0,0,0,0,1,0,1,"AUTO REPAIR",0,,0,91.44,0,0,0,0,2,0,0,NULL,0,,0,0,0,10129,"cleaners under kitchen sink and in outside closet",0,,0,,,0,0,0,0,0,0
CA073110,103,CA083,CA,SS,"2000-09-18 00:00:00",3,E,3,4,0,0,1,0,1,"LINOLEUM IN KITCHEN",2,B,0,,"BETHANY AND SAN FERNANDO VALLEY RD",0,0,0,0,1,0,0,,1,0,0,0,0,,0,0,,0,0,,0,,1,0,,1,0,0,1,0,0,1,0,1,0,0,,1,FREEWAY,0,0,2,0,0,0,0,0,0,NULL,1,"2 CATS",0,0,0,8088,"cleaners under kitchen and bathroom sinks; pesticides under kitchen sink",0,,0,,,0,0,0,0,0,0
CA074110,104,CA084,CA,"SS, NY","2000-09-22 00:00:00",1,B,,6,0,0,1,0,1,"LINOLEUM IN KITCHEN",4,C,0,,"N. GRIFFITH PARK DR. AND MAGNOLIA",0,0,0,0,1,0,0,,0,1,0,0,0,,0,0,,0,0,,0,,0,0,,0,1,0,1,0,0,1,0,1,0,0,,0,,0,0,0,0,0,0,0,0,0,NULL,0,,0,0,0,8015,"cleaners under kitchen and bathroom sinks; paints and solvents in backyard shed",0,,0,,,0,0,0,0,0,0
CA001110,6,CA011,CA,NY,"1999-07-11 00:00:00",4,C,,1,0,0,1,0,0,,1,B,0,,"GAYLEY AND CHARLES E YOUNG",1,1,0,1,0,0,0,,0,0,0,0,0,,1,1,B,0,0,,0,,0,0,,0,1,0,1,0,0,0,1,0,0,0,,0,,0,0,0,0,0,0,0,0,0,NULL,0,,0,0,0,1575,,0,,0,,,0,0,0,0,0,0
CA002110,5,CA012,CA,LS,"0000-00-00 00:00:00",4,E,"3RD FLOOR OF BUILDIN",4,0,0,1,0,0,,3,B,0,,"NATIONAL AND OVERLAND",0,0,0,0,1,0,0,,1,0,0,0,0,,0,0,,0,0,,1,B,1,0,,0,0,1,1,0,0,0,0,0,0,0,,0,,18.288,0,7,0,0,0,0,0,0,NULL,0,,0,0,0,6277,,0,,0,,,0,0,0,0,0,0
CA003110,12,CA013,CA,"LS, DS","1999-08-13 00:00:00",1,B,,6,0,0,1,0,0,,5,B,0,,"S. BENTELY AVE. AND QUEENSLAND ST.",0,1,0,1,0,0,0,,0,1,0,0,0,,0,0,,0,0,,0,,1,0,,0,1,0,1,0,0,0,1,0,1,1,,0,"0.8-1.0 MILE: TRUCK",0,0,1,1,0,0,0,0,0,NULL,0,,0,0,0,10922,"cleaners under bathroom sink, paints and thinners in garage, kitchen cleaners un",0,,0,,,0,0,0,0,0,0
CA004110,13,CA014,CA,NY,"1999-08-18 00:00:00",2,C,,3,0,0,1,0,0,,3,B,0,,"SEPULVEDA BLVD AND RICHLAND AVE.",0,0,0,0,1,0,0,,0,0,0,1,0,,0,1,,0,1,PARKING,0,,1,0,,1,0,0,1,1,0,0,0,0,1,0,,0,"CEMENT FACT., LUMBER",0,182.88,1,0,0,0,0,0,0,NULL,0,,0,0,0,4377,"cleaners, paints, and pesticides under kitchen sink",0,,0,,,0,0,0,0,0,0
CA005110,14,CA015,CA,NY,"1999-08-26 00:00:00",5,C,,2,0,0,1,0,0,,2,C,0,,"NATIONAL BLVD. AND CASTLE HEIGHTS AVE.",0,0,0,0,1,0,0,,0,0,0,1,0,,0,1,,0,1,PARKING,1,B,1,0,,0,1,0,1,0,0,0,1,0,1,0,,0,,0,0,3,1,0,0,0,0,0,NULL,0,,0,0,0,4781,"under sink, in closet",0,,0,,,0,0,0,0,0,0
CA006110,15,CA016,CA,NY,"1999-09-08 00:00:00",2,B,,3,0,0,1,0,0,,3,B,0,,"PURDUE AVE. AND NEBRASKA AVE.",0,0,0,1,1,0,0,,0,0,0,0,0,,1,0,,0,0,,0,,0,0,,0,0,0,0,0,0,0,1,0,0,0,,0,,0,0,2,1,0,0,0,0,0,NULL,0,,0,0,0,4064,"cleaners under bathroom sink",0,,130,F,,0,8,0,0,0,0
CA007110,16,CA017,CA,NY,"1999-09-13 00:00:00",1,B,,5,1,1,1,0,1,"TILE WITH AREA RUGS",4,C,0,,"EXPOSITION BLVD. AND MIDVALE AVE.",0,1,0,0,1,0,0,,0,0,0,0,0,,1,0,,0,0,,0,,1,0,,0,1,0,1,0,0,0,1,0,0,0,,0,,0,0,2,182.88,0,0,0,274.32,0,NULL,0,,0,0,0,9625,"paints in garage, cleaners under kitchen sink",0,,194,F,,0,8,0,0,0,0
CA008110,17,CA018,CA,NY,"1999-09-17 00:00:00",2,C,,1,0,0,1,0,0,,1,B,0,,"SEPULVEDA BLVD. AND NATIONAL BLVD.",0,0,0,0,1,0,0,,0,1,0,0,0,,0,0,,0,0,,0,,0,0,,0,0,0,0,0,0,1,0,1,0,0,,0,,0,0,1,0,0,0,0,0,0,NULL,0,,0,0,0,1721,"cleaners under sink",0,,0,,,0,0,0,0,0,0
CA009110,18,CA019,CA,NY,"1999-09-29 00:00:00",1,B,,5,0,1,0,0,0,,3,B,0,,"OVERLAND AVE. AND ASHBY AVE.",1,0,0,1,0,0,0,,0,1,0,0,0,,0,0,,0,0,,0,,1,0,,0,1,0,0,0,0,0,1,0,1,0,,1,TRAFFIC,68.58,0,0,0,0,0,0,0,0,NULL,1,"1 CAT",0,0,0,6280,"cleaners under bathroom and kitchen sinks",0,,0,,,0,0,0,0,0,0
CA010110,19,CA020,CA,NY,"1999-09-29 00:00:00",1,B,,5,1,1,1,0,0,,2,C,0,,"INGLEWOOD BLVD. AND INDIANAPOLIS AVE.",1,0,0,0,1,0,0,,0,1,0,0,0,,0,0,,0,0,,0,,1,0,,0,1,0,1,0,0,0,0,0,0,0,,0,,1,0,1,0,0,0,0,0,0,NULL,0,,0,0,0,8138,"cleaners under kitchen and bathroom sinks and kitchen cabinet, pints in garage",0,,0,,,0,8,0,0,0,0
CA011110,20,CA021,CA,DS,"1999-09-29 00:00:00",2,C,,2,0,0,1,0,0,,2,C,0,,"SEPULVEDA BLVD. AND RICHLAND AVE.",0,0,0,0,1,0,0,,0,0,0,1,0,,0,1,,0,1,PARKING,0,,1,0,,0,1,0,0,0,0,0,1,0,1,0,,0,,9.144,0,0,0,0,0,0,0,0,NULL,0,,0,0,0,6588,"cleaners under kitchen and bathroom sinks and hall closet. Spray paint in bedroo",0,,0,,,0,0,0,0,0,0
CA012110,21,CA022,CA,DS,"1999-10-08 00:00:00",1,B,,6,1,0,0,0,0,,2,C,0,,"WESTWOOD BLVD. AND ESTHER AVE.",0,0,0,0,1,0,0,,0,1,0,0,0,,0,0,,0,0,,0,,0,0,,0,1,0,1,0,0,0,1,0,1,0,,0,,0,0,0,0,0,0,0,0,0,NULL,1,CATS,0,0,0,3720,"cleaners under kitchen sink, water/oil based paints in office, fertilizers, inse",0,,0,,,0,8,0,0,0,0
CA013110,22,CA023,CA,DS,"1999-10-08 00:00:00",1,B,,6,1,1,1,0,0,,2,B,0,,"STANWOOD DR. AND INGLEWOOD BLVD.",0,0,0,0,1,0,0,,0,1,0,0,0,,0,0,,0,0,,0,,1,0,,0,1,0,0,0,0,0,1,0,0,0,,0,,0,182.88,0,0,0,0,0,0,0,NULL,0,"1 PARROT",0,0,0,901,"cleaners in laundry room closet, paints in garage cabinet",0,,0,,,0,8,0,0,0,0
CA014110,23,CA024,CA,NY,"1999-10-15 00:00:00",1,B,,2,0,0,1,0,0,,2,B,0,,"SAWTELLE BLVD. AND NATIONAL BLVD.",0,0,0,0,1,0,0,,0,1,0,0,0,,0,0,,0,0,,0,,0,0,,1,0,1,0,0,0,1,0,1,0,0,,0,,0,182.88,0,0,0,0,0,0,0,NULL,0,,0,0,0,3443,"cleaning compounds and insecticides under sink",0,,0,,,0,8,0,0,0,0
CA015110,24,CA025,CA,DS,"1999-10-22 00:00:00",1,B,,6,0,1,0,0,0,,0,B,0,,"OVERLAND AND PICO",0,0,0,0,1,0,0,,0,1,0,0,0,,0,0,,0,0,,0,,0,0,,0,1,0,1,0,0,0,1,0,1,0,,0,,365.76,457.2,0,137.16,0,0,0,0,0,NULL,0,,0,0,0,6061,"cleaning compounds under bathroom and kitchen sinks",0,,0,,,0,0,0,0,0,0
CA016110,25,CA026,CA,DS,"1999-10-22 00:00:00",1,B,,1,0,0,1,0,0,,1,B,0,,"S. SEPULVEDA AND EXPOSITION OR RICHLAND",0,0,0,1,0,0,0,,0,1,0,0,0,,0,0,,0,0,,0,,0,1,"CEMENT PLANT, TRUCK",0,1,0,1,0,0,0,1,0,1,0,,1,CONSTRUCTION,0,1,182.88,0,0,0,0,0,0,NULL,0,,0,0,0,2112,"cleaners under bathroom and kitchen sinks",0,,0,,,0,0,0,0,0,0
CA017110,26,CA027,CA,NY,"1999-10-29 00:00:00",1,B,,4,0,1,0,0,0,,0,C,0,,"INGLEWWOD BLVD.",0,0,0,0,1,0,0,,0,1,0,0,0,,0,0,,0,0,,0,,0,0,,0,0,0,0,0,0,0,0,0,0,0,,0,,0,0,0,0,0,0,0,0,0,NULL,0,,0,0,0,7310,"cleaners under kitchen sink",0,,0,,,0,0,0,0,0,0
CA018110,27,CA028,CA,DS,"1999-11-03 00:00:00",2,B,,2,0,0,1,0,0,,2,C,0,,"ROSE AVE. AND OVERLAND AVE.",0,0,0,1,0,0,0,,0,0,0,1,0,,0,1,C,0,1,LAUNDRY,1,,0,0,,0,0,0,1,0,0,1,0,0,0,0,,0,,0,0,0,1,0,0,0,0,0,NULL,0,,0,0,0,5189,"cleaners under bathroom sink",0,,0,,,0,8,0,0,0,0
CA019110,28,CA029,CA,NY,"1999-11-03 00:00:00",1,B,,6,0,1,1,0,0,,4,C,0,,"STONER AVE. AND STANWOOD AVE.",0,0,0,0,1,0,0,,0,1,0,0,0,,0,0,,0,0,,0,,1,0,,0,1,0,0,0,0,0,1,0,1,0,,0,,0,0,1,0,0,0,0,0,0,NULL,0,,0,0,0,5848,"cleaners under kitchen sink",0,,0,,,0,0,0,0,0,0
CA020110,29,CA030,CA,DS,"1999-12-10 00:00:00",1,B,,6,0,1,0,0,0,,0,C,0,,"GRAND VIEW AND NATIONAL",0,0,0,0,0,0,0,,0,0,0,0,0,,0,0,,0,0,,0,,0,0,,0,0,0,1,0,0,0,0,0,0,0,,0,,91.44,0,1,0,0,0,0,0,0,NULL,0,,0,0,0,9835,"cleaners under kitchen sink",0,,0,,,0,8,0,0,0,0
CA021110,8,CA031,CA,DS,"2000-01-14 00:00:00",1,B,,6,1,0,1,0,1,"MARBLE TILES",3,C,0,,"WALNUT ST AND 16TH ST",0,0,0,1,0,0,0,,0,1,0,0,0,,0,0,,0,0,,0,,0,0,,0,0,0,0,0,0,0,0,0,0,1,"ROAD WITH UNPAVED SI",1,METROLINK,1,1,0,0,0,0,0,0,9.144,NULL,1,"1 DOG",0,0,0,4206,"cleaners under kitchen and bathroom sinks; pesticides in backyard",0,,0,,,0,0,0,0,0,0
CA022110,7,CA032,CA,"CG, DS","2000-01-19 00:00:00",1,B,,6,0,0,1,0,0,,5,B,1,CLUTTERED,"WILEY CANYON AND WABUSKA",0,0,1,0,0,0,0,,0,0,0,0,1,"MOBILE HOME",0,0,,0,0,,0,,0,0,,0,1,0,1,0,0,0,1,0,0,0,,0,,91.44,0,0,0,0,0,0,0,0,NULL,1,"1 DOG, 4 INDOOR CATS",0,0,0,4600,"bleach in laundry area; cleaners under kitchen sink and in master bath",0,,0,,,0,0,0,0,0,0
CA023110,69,CA033,CA,DS,"2000-01-28 00:00:00",2,C,,5,0,1,1,0,0,,3,C,0,,"AVENIDA DORENA AND LYONS AVE.",1,0,0,1,0,0,0,,1,0,0,0,0,,0,0,,0,0,,0,,0,1,"SEVERAL GAS STATIONS",0,0,1,1,0,0,0,1,0,0,1,"RSIDENCE CONSTRUCTIO",0,,548.64,91.44,0,0,0,0,0,0,0,NULL,1,"1 CAT, 1 DOG",0,0,0,5186,"cleaners and paints in garage",0,,0,,,0,0,0,0,0,0
CA024110,70,CA034,CA,NY,"2000-02-04 00:00:00",1,B,,7,0,1,0,0,0,,4,B,0,,"MARKEL DR. AND DENICE PL.",1,1,0,0,1,0,0,,0,0,0,0,0,,1,0,,0,0,,0,,1,0,,0,1,0,1,0,0,0,1,0,1,1,"CONSTRUCTION NEAR FR",0,,365.76,365.76,0,0,0,0,5486.4,1371.6,0,NULL,1,"2 DOGS",0,0,0,5707,"cleaners under bathroom and kitchen sinks, gas in shed, paints in garage",0,,0,,,0,0,0,0,0,0
CA025110,71,CA035,CA,CG,"2000-02-07 00:00:00",1,B,,3,0,0,1,0,1,TILE,4,B,0,,"LYONS AND WALNUT",0,0,0,0,1,0,0,,0,1,0,0,0,,0,0,,0,0,,0,,0,0,,0,0,0,0,0,0,0,0,0,0,0,,0,,0,0,0,0,0,0,0,91.44,0,NULL,1,"1 BIRD",0,0,0,5336,"cleaners under kitchen sink",0,,0,,,0,0,0,0,0,0
CA026110,72,CA036,CA,NY,"2000-02-11 00:00:00",1,B,,4,0,0,1,0,1,"FLOOR TILE AND PARTI",4,B,0,,"WABUSUA ST. AND HAWKBRYN AVE.",0,0,0,0,0,0,1,STEEL,0,0,0,0,0,,1,0,,0,0,,0,,1,0,,0,1,0,1,0,0,0,1,0,1,0,,0,,0,0,0,0,0,0,0,0,0,NULL,0,,0,0,0,4652,"pesticides under kitchen sink and paints in shed",0,,0,,,0,0,0,0,0,0
CA027110,73,CA037,CA,DS,"2000-02-18 00:00:00",1,B,,7,0,0,1,0,0,,6,C,0,,"CHERYL KELTON",0,0,0,0,1,0,0,,1,0,0,0,0,,0,0,,0,0,,0,,0,0,,0,1,0,1,0,0,0,1,0,1,0,,0,,0,0,0,0,0,0,0,0,0,NULL,0,,0,0,0,6408,"paints in garage, cleaners under kitchen and bathroom sink",0,,0,,,0,0,0,0,0,0
CA028110,74,CA038,CA,"DS, NY","2000-02-21 00:00:00",2,B,,5,0,0,1,0,0,,4,B,0,,"DORENA AVE. AND LA GLORITA CIRCLE",0,1,0,0,1,0,0,,1,1,0,0,0,,0,0,,0,0,,0,,0,0,,0,1,0,1,0,0,0,1,0,1,0,"CONSTRUCTION ON LYON",0,,457.2,457.2,0,0,0,2,0,0,0,NULL,0,"LIZARD AND GOLDFISH",0,0,0,4149,"cleaners under bathroom and kitchen sinks and pesticides in garage",0,,0,,,0,0,0,0,0,0
CA029110,75,CA039,CA,DS,"2000-03-01 00:00:00",2,B,,5,0,0,1,0,0,,4,C,0,,,0,1,0,0,1,0,0,,1,0,0,0,0,,0,0,,0,0,,0,,0,0,,1,1,0,1,0,0,1,1,1,1,0,,0,,457.2,91.44,0,0,0,0,0,0,0,NULL,0,,0,0,0,4591,"paints in garage and cleaners under kitchen sink",0,,0,,,0,0,0,0,0,0
CA030110,76,CA040,CA,CG,"2000-03-08 00:00:00",1,B,,5,1,0,1,0,1,"TILE IN KITCHEN AND",4,C,0,,"LYONS AND WILEY CANYON",0,0,0,0,1,0,0,,1,0,0,0,0,,0,0,,0,0,,0,,0,0,,0,1,0,1,0,0,0,1,0,1,0,,0,,0,0,0,0,0,0,0,0,0,NULL,0,"1 DOG",0,0,0,5601,"cleaners under kitchen and bathroom sink, paints in garage",0,,0,,,0,0,0,0,0,0
CA031110,77,CA041,CA,"DS, NY","2000-03-13 00:00:00",2,B,,4,0,0,1,0,0,,3,C,0,,"WALNUT ST. AND 10TH ST.",1,1,0,0,1,0,0,,1,0,0,0,0,,0,0,,0,0,,0,,0,0,,0,0,0,0,0,0,0,0,0,0,1,"UNPAVED ROAD (100 Y)",0,,0,0,0,0,0,0,0,91.44,0,NULL,0,,0,0,0,3322,"cleaners under kitchen and bathroom sinks, paits under bathroom sink",0,,0,,,0,0,0,0,0,0
CA032110,78,CA042,CA,"NY, DS","2000-04-05 00:00:00",2,B,,5,0,0,1,0,0,,4,C,0,,"PLAYER DR. AND GOLFVIEW DR.",1,0,0,0,1,0,0,,1,0,0,0,0,,0,0,,0,0,,0,,0,0,,0,1,0,0,0,0,0,1,0,0,0,,0,,0,0,0,1,0,0,0,0,0,NULL,0,"1 DOG",0,0,0,7204,"cleaners under sink, pesticides and paint in garage",0,,0,,,0,0,0,0,0,0
CA033110,79,CA043,CA,DS,"2000-04-10 00:00:00",1,B,,5,0,0,1,0,0,,5,B,0,,"JENNIFER PL. AND CHERYL KELTON RD.",1,1,0,1,0,0,0,,1,0,0,0,0,,0,0,,0,0,,0,,1,0,,0,1,0,1,0,0,0,1,0,1,0,,0,,91.44,0,0,0,0,0,0,0,0,NULL,1,"2 DOGS, 2 CATS",0,0,0,7150,"cleaners under kitchen and bathroom sinks, paints and thinners in garage",0,,0,,,0,0,0,0,0,0
CA034110,80,CA044,CA,LS,"2000-04-14 00:00:00",2,B,,5,0,0,1,0,0,,4,B,0,,"LYON AVE. AND WALNUT",0,0,0,0,1,0,0,,1,0,0,0,0,,0,0,,0,0,,0,,0,0,,0,0,0,1,0,0,0,1,0,0,1,"CHESTNUT ST. UNPAVED",0,,1,0,0,0,0,0,0,45.72,0,NULL,1,"1 TURTLE",0,0,0,2910,"cleaners under kitchen and bathroom sinks, insecticides under kitchen sinks.",0,,0,,,0,0,0,0,0,0
CA035110,81,CA045,CA,"DS, LS","2000-04-12 00:00:00",1,B,,3,1,0,1,0,1,"PREFABRICATED TILE F",2,A,0,,"HAWKBYRN AVE. AND WABUSHKA ST.",0,0,1,0,0,0,1,"PREFABRICATED BOARDI",0,1,0,0,1,"PREFAB. MOBILE HOME",0,0,,0,0,,0,,0,0,,0,1,0,1,0,0,0,1,0,1,1,"RESUSPENDED STREET D",0,,45.72,914.4,0,0,0,0,0,0,36.576,NULL,1,"4 CATS",0,0,0,2750,,0,,0,,,0,0,0,0,0,0
CA036110,82,CA046,CA,"DS, LS","2000-04-12 00:00:00",1,B,,3,0,0,1,0,0,,2,C,0,,"15TH ST. AND WALNUT ST.",0,0,0,0,1,0,0,,0,1,0,0,0,,0,0,,0,0,,0,,0,0,,0,0,0,1,0,0,0,1,0,1,1,"CHESTNUT ST. UNPAVED",0,,731.52,0,0,0,0,0,1,45.72,0,NULL,0,,0,0,0,2578,,0,,0,,,0,0,0,0,0,0
CA037110,83,CA047,CA,NY,"2000-04-19 00:00:00",2,C,,3,0,0,1,0,0,,2,B,0,,"WALNUT ST. AND 15TH ST.",0,0,0,0,1,0,0,,1,0,0,0,0,,0,0,,0,0,,1,B,0,0,,0,0,0,1,0,0,0,1,0,0,0,"CHESTNUT ST. UNPAVED",0,,0,45.72,0,0,0,0,0,45.72,0,NULL,0,,0,0,0,3258,"cleaners under kitchen sink",0,,0,,,0,0,0,0,0,0
CA038110,84,CA048,CA,NY,"2000-04-24 00:00:00",1,B,,5,0,0,1,0,0,,4,C,0,,"HILSE LN. AND WALNUT ST.",1,0,0,0,0,0,1,STONE,1,0,0,0,0,,0,0,,0,0,,1,B,0,0,,0,0,0,1,0,0,0,1,0,0,0,"CHESTNUT ST. UNPAVED",0,,0,0,0,0,0,0,0,27.432,0,NULL,1,"2 DOGS",0,0,0,5154,"cleaners under kitchen and batroom sinks and in garage",0,,0,,,0,0,0,0,0,0
CA039110,85,CA049,CA,NY,"2000-04-24 00:00:00",1,B,,8,1,0,0,0,0,,0,C,0,,"CHESTNUT ST. AND 15TH ST.",1,0,0,0,1,0,0,,0,1,0,0,0,,0,0,,0,0,,0,,0,0,,0,0,0,1,0,0,0,1,0,0,0,,0,,0,0,0,1,0,0,0,0,0,NULL,1,"1 DOG, 1 CAT",0,0,0,8872,"cleaners in hall bt bedroom and kitchen, paints and thinner in garage",0,,0,,,0,0,0,0,0,0
CA040110,86,CA050,CA,"NY, DS","2000-05-01 00:00:00",1,B,,6,0,0,1,0,0,,6,B,0,,"LISA KELTON AND MARKEL",1,1,0,0,1,0,0,,1,0,0,0,0,,0,0,,0,0,,1,B,0,0,,0,1,0,1,0,0,0,1,0,1,0,"CHESTNUT ST. UNPAVED",0,,274.32,0,0,1,0,0,0,0,0,NULL,1,"1 DOG",0,0,0,6302,"cleaners under kitchen and bathroom sinks, gas can in garage",0,,0,,,0,0,0,0,0,0
CA041110,30,CA051,CA,NY,"2000-05-05 00:00:00",1,B,,5,0,1,0,0,0,,1,B,0,,"S. BENTLY AND RICHLAND AVE.",1,0,0,0,1,0,0,,0,1,0,0,0,,0,0,,0,0,,0,,0,0,,0,1,0,1,0,0,0,1,0,1,0,,0,,45.72,365.76,1,0,0,0,0,0,0,NULL,0,"3 CATS",0,0,0,3640,"cleaners and insecticides in kitchen pantry",0,,0,,,0,0,0,0,0,0
CA075110,105,CA085,CA,JJ,"2000-09-25 00:00:00",1,B,,6,0,1,1,0,1,"LINOLEUM IN KITCHEN",4,B,0,,"N. GRIFFITH PK BTWN MAGNOLIA AND CHANDLER",0,0,0,0,1,0,0,,0,1,0,0,0,,0,0,,0,0,,1,B,1,0,,0,0,0,1,0,1,0,1,0,1,0,,1,"AUTO REPAIR SHOP",1,1,0,0,0,0,1,0,0,NULL,1,"1 CAT",0,0,0,9827,"cleaners under kitchen sink; pool chemicals outside",0,,0,,,0,0,0,0,0,0
CA076110,106,CA086,CA,"DS, NY","2000-09-21 00:00:00",2,B,,4,0,0,1,0,1,"LINOLEUM IN KITCHEN",3,A,0,,"SCOTT RD AND SAN FERNANDO VALLEY RD",0,0,0,0,0,0,0,"NOT NOTED",1,0,0,0,0,,0,0,,0,0,,0,,0,0,,1,0,0,1,0,0,1,0,1,0,0,,1,FREEWAY,0,182.88,0,1,0,0,1,0,0,NULL,0,,0,0,0,4192,"cleaners under sink",0,,0,,,0,0,0,0,0,0
CA077110,107,CA087,CA,CF,"2000-09-29 00:00:00",1,B,,4,1,0,1,0,1,LINOLEUM,1,A,0,,"SCOTT RD AND SAN FERNANDO RD",0,0,0,0,1,0,0,,0,1,0,0,0,,0,0,,0,0,,0,,0,0,,0,1,0,1,0,0,0,1,0,0,1,FREEWAY,1,"AUTO REPAIR SHOPS",91.44,0,2,0,0,0,1,0,0,NULL,0,,0,0,0,4523,"cleaners under kitchen sink and in laundry room; paints and pesticides in garage",0,,0,,,0,0,0,0,0,0
CA078110,108,CA088,CA,DGS,"2000-09-29 00:00:00",1,B,,6,0,1,1,0,1,"KITCHEN TILES; LIVIN",5,C,0,,"GRIFFITH PK AND MAGNOLIA BLVD",1,0,0,1,0,0,0,,0,1,0,0,0,,0,0,,0,0,,0,,0,0,,0,0,0,1,0,0,0,1,0,0,0,,0,,0,0,2,0,0,0,0,0,0,NULL,0,,0,0,0,10004,"cleaners on back porch in cupboard; chlorox in detached garage",0,,0,,,0,0,0,0,0,0
CA079110,41,CA100,CA,NY,"2000-06-08 00:00:00",1,B,,6,0,0,1,0,0,,5,C,0,,"CHARNOCK AND MCLAUGHLIN",1,1,0,0,1,0,0,,0,1,0,0,0,,0,0,,0,0,,0,,0,0,,0,0,0,1,0,0,0,0,0,0,0,,0,,0,0,0,0,0,0,0,0,0,NULL,0,,0,0,0,4453,"cleaners under kitchen sink and gasoline in garage",0,,0,,,0,0,0,0,0,0
CA080110,42,CA101,CA,DS,"2000-06-22 00:00:00",3,E,,5,0,0,1,0,1,"TILE IN BATHROOMS AN",4,B,0,,"SANTA MONICA AND BENTLY",0,0,0,1,0,0,0,,1,0,0,0,0,,0,0,,0,0,,0,,0,0,,0,1,0,1,0,0,0,1,0,1,0,,0,,137.16,137.16,3,0,0,0,0,0,0,NULL,0,,0,0,0,4212,"cleaners under kitchen and bathroom sinks and in closet",0,,0,,,0,0,0,0,0,0
CA081110,43,CA102,CA,DS,"2000-06-22 00:00:00",3,C,,4,0,0,1,0,0,"TILE IN KITCHEN",3,C,0,,"SEPULVEDA AND NATIONAL",0,0,0,1,0,0,0,,1,0,0,0,0,,0,0,,0,0,,0,,0,0,,0,1,0,1,0,0,0,1,0,1,0,,0,,182.88,182.88,2,1,0,0,0,0,0,NULL,0,,0,0,0,3077,"cleaners in kitchen and bathroom sinks, insecticides under kitchen sink",0,,0,,,0,0,0,0,0,0
CA082110,44,CA103,CA,DS,"2000-07-06 00:00:00",3,C,,4,0,0,1,0,0,,3,C,0,,"SAWTELLE AND NATIONAL",0,0,0,0,1,0,0,,1,0,0,0,0,,0,0,,0,0,,1,B,0,0,,0,0,0,1,0,0,1,0,0,0,1,FREEWAY,0,,0,0,0,0,0,0,0,0,0,NULL,0,,0,0,0,5384,,0,,0,,,0,0,0,0,0,0
CA083110,45,CA104,CA,"LS, SS","2000-07-13 00:00:00",3,B,,4,0,0,1,0,0,,3,C,0,,"SEPULVEDA AND NATIONAL",0,0,0,0,1,0,0,,1,0,0,0,0,,0,0,,0,0,,0,,0,0,,0,1,0,1,0,0,0,1,0,1,1,FREEWAY,0,,18.288,0,0,0,0,0,0,0,0,NULL,0,,0,0,0,5755,,0,,0,,,0,0,0,0,0,0
